,author,text,published_at,like_count,video_id,year_month
2250,@THENCC2024,the fakest conversation ever 💀,2024-05-15 13:07:59+00:00,3,_nSmkyDNulk,2024-05
2251,@freddym6643,"""What sort of default voice should we give GPT-4o guys? Developer team in unison: Mommy""",2024-05-14 11:53:32+00:00,0,_nSmkyDNulk,2024-05
2252,@cyberninjanj,Finally we can freely explain our problems?,2024-06-07 10:56:41+00:00,0,_nSmkyDNulk,2024-06
2253,@taganaafaw3970,"With World-class Teacher level with infinite patience for every student for 20$/month, the bare entry diploma in the workplace will raise from Master to Phd soon, if Job still do Exist....",2024-05-15 21:23:09+00:00,1,_nSmkyDNulk,2024-05
2254,@Tirelesssoulmanish,Gaurav Garg Sir ke kahne pe aaya 😊👏,2024-05-17 13:26:15+00:00,2,_nSmkyDNulk,2024-05
2255,@NavyaTiwari-ug6dn,It will be very beneficial for Indian students. Jai Hind jai OpenAI,2024-06-07 11:27:15+00:00,0,_nSmkyDNulk,2024-06
2256,@klioseth4336,"Not only has AI the potential to be FAR better than the average teacher, but it also has the potential for free, personalized education tailored for the needs, strengths and weakenesses of every student. And you wont have to get a new 'teacher' every semester. Iy can follow your progress from learning multiplication tables all the way to multivariate calculus.It can do all this 24h a day, no matter your financial situation, your geographical location and will never retire.Its a massive win for humanity. Given time, it might even be as disrupting to education as the printing press.",2024-05-15 15:54:18+00:00,1,_nSmkyDNulk,2024-05
2257,@aniketrangari167,Gaurav Sir ne bheja hai bhai 🤗,2024-05-17 03:24:49+00:00,1,_nSmkyDNulk,2024-05
2258,@bikgrow,As a human respect to the Ai teacher,2024-05-18 00:48:13+00:00,0,_nSmkyDNulk,2024-05
2259,@priyanshusoni5431,Dr. Gaurav Garg Ne Bheja Hai Mujhe 😂😂❤❤,2024-05-17 11:45:56+00:00,1,_nSmkyDNulk,2024-05
2260,@Prodbybah,If this was 15 years ago khan academy wouldn't exist,2024-06-17 14:33:18+00:00,0,_nSmkyDNulk,2024-06
2261,@art2acting494,Dr. Gaurav Garg sir send me here ❤,2024-05-17 03:52:19+00:00,2,_nSmkyDNulk,2024-05
2262,@QuantumQuasar91,The thing we wish we had 10 years ago,2024-05-15 13:28:23+00:00,1,_nSmkyDNulk,2024-05
2263,@BreakifyTV,"Ah OpenAI, ending teacher's careers, one day at a time! :)",2024-05-15 17:56:45+00:00,0,_nSmkyDNulk,2024-05
2264,@journeytobebanker,Suggested by gaurav Garg sir to watch it.... really loved to see how it works ❤,2024-05-17 01:39:21+00:00,1,_nSmkyDNulk,2024-05
2265,@smritasingh1213,I have come here on the advice of Gaurav Sir.,2024-05-17 01:17:46+00:00,1,_nSmkyDNulk,2024-05
2266,@SG-gq2rf,All the Math the kids will learn will really help them when they enter the job mar....never mind.,2024-05-15 03:42:18+00:00,1,_nSmkyDNulk,2024-05
2267,@ajmalrashid,"I asked GPT-4o to create Simple Geometry Problem with figures, related to the topic of ""angle sum property of triangle."" It failed to draw the figures in the first attempt. In the second attempt, it drew some vague figures. It needs to work hard. 😂",2024-05-19 06:47:12+00:00,0,_nSmkyDNulk,2024-05
2268,@stefanmartinjansen,I think this is a great development for kids who need more help since teachers these days have less time per kid.,2024-05-19 10:57:24+00:00,0,_nSmkyDNulk,2024-05
2269,@cyrus2.6,Khan academy sweating rn,2024-05-18 15:00:24+00:00,2,_nSmkyDNulk,2024-05
2270,@dhruv6590,"I asked chat gpt "" What is the LCM of 1 and √2?"" It literally said √2 😂",2024-05-16 15:39:49+00:00,0,_nSmkyDNulk,2024-05
2271,@FirstNameLastName-fv4eu,I normally watch Peppa Pig with my kiddo when I want to connect.,2024-05-15 00:41:22+00:00,0,_nSmkyDNulk,2024-05
2272,@Chameo-San,Finally... I can learn rocket science.,2024-05-23 02:30:05+00:00,1,_nSmkyDNulk,2024-05
2273,@algeriapower7242,"Good start, albeit this is a basic problem that can barely be called math, but I learned to never underestimate ai",2024-05-15 01:14:14+00:00,0,_nSmkyDNulk,2024-05
2274,@evo4gplus,Now that's impressive,2024-05-14 12:44:50+00:00,1,_nSmkyDNulk,2024-05
2275,@bilalwardak1999,"dont worry khan, nothing with ever beat your khan academy legacy",2024-05-14 14:20:43+00:00,0,_nSmkyDNulk,2024-05
2276,@notthere83,The new features certainly help but I've already been using GPT (4. 3 was pretty bad in comparison.) heavily instead of tutors or secondary literature (that may or may not contain what you want to know) for almost a year now.It's been so helpful that I wonder how things would've gone without. I probably would've still passed my classes but I wouldn't have understood nearly as much.,2024-05-14 15:38:25+00:00,0,_nSmkyDNulk,2024-05
2277,@jayminshah8641,Thanks Sal for teaching me calculus,2024-05-16 14:27:26+00:00,0,_nSmkyDNulk,2024-05
2278,@gamingislife5317,I asked 10 jee mains question and 7 of them were wrong in inorganic chemistry 😂,2024-05-18 08:15:00+00:00,1,_nSmkyDNulk,2024-05
2279,@dmihovilovic,Great concept!,2024-05-15 00:34:04+00:00,0,_nSmkyDNulk,2024-05
2280,@Vibes-v8b,"In fact, I have always used it in medical studies since the beginning of my studies, and I have never dispensed with it until now 🤣",2024-06-11 22:00:07+00:00,0,_nSmkyDNulk,2024-06
2281,@user20345,Kid is cute as hell❤❤,2024-05-16 13:04:14+00:00,1,_nSmkyDNulk,2024-05
2282,@schemagroup1,This is the most impressive demo of chapGPT 4.0o new model Vision.,2024-05-14 21:20:41+00:00,0,_nSmkyDNulk,2024-05
2283,@erin758,"I asked 4o this for testing:""The length of each side of a square is increased by 3m. The area of the 'new' square is 39 m2 more than that of the original square. How long are the sides of the 'new' square?""It went on giving wrong answers and went on a loop of solving it again and again and stops.This is GPT's answer by the wayx= 3/12 = 1/4",2025-01-30 15:21:36+00:00,0,_nSmkyDNulk,2025-01
2284,@ShubhPatel2010,Me who solved it before the video started:🗿🤫🧏‍♂️,2024-06-07 10:43:32+00:00,2,_nSmkyDNulk,2024-06
2285,@r-ddle,"If everybody uses this for education, there is a chance for many many people to lose their jobs in schools and other educational government stuffBut openai's technology is really impressive and shocking",2024-05-14 18:54:34+00:00,0,_nSmkyDNulk,2024-05
2286,@rogerfederer9523,we are so living in those sci-fi movies we used to watch in the 2000s,2024-05-14 16:07:24+00:00,0,_nSmkyDNulk,2024-05
2287,@kato_dsrdr,This about to change the world. I sure hope it's for the better.,2024-05-27 03:17:49+00:00,0,_nSmkyDNulk,2024-05
2288,@கோபிசுதாகர்,Lol they choose the easiest problem as the demo 😂😂 i like how the kid purposely tries to get the hypotenuse wrong,2024-05-15 12:28:53+00:00,2,_nSmkyDNulk,2024-05
2289,@ItsDeffoScott,"I feel humanity will become so siloed from social contact by technology in future that in-person social gatherings will need to come full circle again as a quirky, retro and cool trend.",2024-05-16 11:10:36+00:00,0,_nSmkyDNulk,2024-05
2290,@vaibhavsharma4311,no matter how advance AI will never match human level of intelligence backstory: i lost my job to AI,2024-05-17 09:40:42+00:00,1,_nSmkyDNulk,2024-05
2291,@SuperHeromindNsoul,Wow my grandma who knows nothing about computers always calls her chat gpt her Administrative assistant,2024-05-18 17:53:46+00:00,1,_nSmkyDNulk,2024-05
2292,@FabulousFacade-c1z,As a 9 th grader in India this is easy asf,2024-06-06 12:17:45+00:00,1,_nSmkyDNulk,2024-06
2293,@andromeda3542,"*Enhancing AI Interactivity with Audio and Video Feedback Loops*The evolution of artificial intelligence, particularly in the realm of conversational agents, has been rapid and remarkable. With the recent advancements in GPT-4O (Omni), the capabilities of AI have expanded beyond text processing to include multimodal inputs such as images and audio. However, there remains significant potential for further enhancement, particularly through the implementation of audio and video feedback loops.*The Concept of Feedback Loops*A feedback loop, in the context of AI, refers to the process where an AI system can receive and process its own outputs. For instance, when an AI generates audio responses, these could be looped back into the system, allowing it to ""hear"" itself. Similarly, for visual outputs, the AI could ""see"" its own video responses. This concept is analogous to how humans perceive their own voices and visual presence, enabling adjustments in real-time to improve clarity, tone, and emotional expressiveness.*Technical Implementation*1. **Audio Feedback Loop**:    - The AI's audio output would be fed back into its own auditory processing unit. By analyzing its own voice, the AI could adjust parameters such as pitch, tone, and volume to better match the intended emotional tone or to improve mimicry of specific voices.   - This requires the integration of advanced auditory feedback systems and real-time processing algorithms to allow immediate adjustments. For instance, machine learning models trained on voice modulation could provide instant feedback and corrective measures.2. **Video Feedback Loop**:    - Similar to the audio loop, the video output generated by the AI could be fed back into its visual processing systems. This would enable the AI to assess the quality of its visual responses, such as facial expressions or gestures if anthropomorphic avatars are used.   - Implementing this would involve integrating video analysis tools that can evaluate and enhance visual output in real-time, ensuring that the visual cues are consistent with the spoken content and emotional tone.*Benefits of Feedback Loops*1. **Improved Realism**: By continuously monitoring and adjusting its own outputs, the AI can produce more human-like interactions. This is particularly important for applications requiring high emotional intelligence, such as virtual assistants or customer service bots.2. **Enhanced User Experience**: Users are likely to find interactions more engaging and satisfactory if the AI can adjust its tone and visual cues to better match the context of the conversation.3. **Consistency and Accuracy**: Feedback loops can help maintain consistency in voice and visual presentations, reducing the likelihood of jarring discrepancies in long conversations.*Future Directions*Incorporating feedback loops is a forward-thinking approach that aligns with the ongoing efforts to make AI more interactive and responsive. As AI technologies continue to evolve, such features could become standard, leading to interactions that are indistinguishable from human communication. The development of these systems requires collaboration between audio-visual engineers, AI researchers, and user experience designers to create holistic solutions that enhance AI's capabilities and usability.In conclusion, the integration of audio and video feedback loops into AI models like GPT-4O represents a significant step towards more natural and effective human-AI interactions. This enhancement not only promises to improve the technical performance of AI systems but also has profound implications for their acceptance and integration into daily life.",2024-05-15 18:02:16+00:00,1,_nSmkyDNulk,2024-05
2294,@davidsolomon5999,The scariest thing humans could ever see in the future,2024-05-18 13:33:20+00:00,1,_nSmkyDNulk,2024-05
2295,@jonathantighe146,me in 50 years: “I remember in my day when all my teachers were analog”,2024-05-15 21:16:20+00:00,0,_nSmkyDNulk,2024-05
2296,@doctorpanigrahi9975,This is Unreal,2024-06-02 13:53:56+00:00,1,_nSmkyDNulk,2024-06
2297,@sachinkumar-yh9sg,One Like Gaurav Sir  who taught us about it.,2024-05-17 14:16:15+00:00,1,_nSmkyDNulk,2024-05
2298,@paulallen8304,I think this could do for teachers what online shopping and delivery has done for retail... remove the abuse from the equation. If this were implemented in such a way as to show exactly what a kid did and when there could be no deflected blame.,2024-05-16 15:28:58+00:00,0,_nSmkyDNulk,2024-05
2299,@The.Pirate1986,it speaks and explains a thousand times better than my teachers 😵‍💫,2024-05-16 07:00:44+00:00,1,_nSmkyDNulk,2024-05
2300,@Inspector.abhinav,Come from Dr Gaurav Garg sir Study IQ,2024-05-17 04:33:40+00:00,2,_nSmkyDNulk,2024-05
2301,@Ryansanvy,Love to see Sal 😍,2024-05-16 20:57:03+00:00,0,_nSmkyDNulk,2024-05
2302,@zeryozero,"""Her"" is becoming reality right now",2024-05-13 17:45:17+00:00,6628,vgYi3Wr7v_g,2024-05
2303,@knight808.,"She talks like a crazy obsessive stalker that pretends to not know who you are but in actuality, knows every single small detail about your personal life 😭",2024-05-13 19:44:49+00:00,4026,vgYi3Wr7v_g,2024-05
2304,@youkers5841,"“Hey ChatGPT, I’m pretty sure this is above average right?”",2024-05-13 18:49:30+00:00,1640,vgYi3Wr7v_g,2024-05
2305,@wtevwwe11,"Me watching Her: ""I'm sure this will be a thing by 2050"" 2024: 💀",2024-05-14 07:08:49+00:00,615,vgYi3Wr7v_g,2024-05
2306,@IgorKornilov-kd3ol,I see it as a great tool to learn a language. Speaking skills will be blown out after that,2024-05-13 19:18:37+00:00,150,vgYi3Wr7v_g,2024-05
2307,@Quinten372,Discord simps gonna love this,2024-05-13 17:44:45+00:00,3851,vgYi3Wr7v_g,2024-05
2308,@diradosveta,Get Scarlett Johansson to voice it,2024-05-13 17:59:35+00:00,4063,vgYi3Wr7v_g,2024-05
2309,@clay_arrobakker,"we're getting scarily close to having people talk to AI and think it's a person instead, never knowing.",2024-05-13 17:52:03+00:00,1413,vgYi3Wr7v_g,2024-05
2310,@TaylorCks03,The tutoring ability alone is a huge gift to the world. Thank you,2024-05-14 11:26:42+00:00,16,vgYi3Wr7v_g,2024-05
2311,@DeSuenner,"The robot looks really convincing, he is talking kind of mechanic but still, the way he is holding the phone and everything. Open ai is really a top notch robotics company 👍",2024-05-15 07:31:43+00:00,26,vgYi3Wr7v_g,2024-05
2312,@durtyred86,We're almost there.,2024-05-13 17:43:37+00:00,1791,vgYi3Wr7v_g,2024-05
2313,@notorious3875,"""she's real to me""",2024-05-13 18:04:13+00:00,582,vgYi3Wr7v_g,2024-05
2314,@ifoundthistoday,I can't decide if I should applaud or go hide in a bunker.,2024-05-13 17:59:21+00:00,1829,vgYi3Wr7v_g,2024-05
2315,@ultimasterreviews3693,"""You look lonely. I can fix that."" Ahh product",2024-05-15 18:41:54+00:00,14,vgYi3Wr7v_g,2024-05
2316,@November,"perhaps slightly too talkative, almost uncomfortable watching him anxious to get his own words in",2024-05-13 19:31:57+00:00,1548,vgYi3Wr7v_g,2024-05
2317,@oscardjuric8334,Can't wait for the fireship video,2024-05-13 18:25:48+00:00,521,vgYi3Wr7v_g,2024-05
2318,@greenarcade1379,She can fix me bros,2024-05-13 18:12:00+00:00,1047,vgYi3Wr7v_g,2024-05
2319,@dante-alighieri-b4c,This model's smoothiness is something I would never imagine we would see so early. This thing is going crazy,2024-05-13 18:40:45+00:00,340,vgYi3Wr7v_g,2024-05
2320,@Nuggetz69th,"0:56 I dont like how real that laugh sounds, we're so cooked",2024-06-20 18:40:08+00:00,11,vgYi3Wr7v_g,2024-06
2321,@Droid3455,AI waifu is getting closer and closer to being a reality,2024-05-13 23:02:33+00:00,66,vgYi3Wr7v_g,2024-05
2322,@AstronautEngineerGokan,Dude her voice is so natural,2024-05-13 18:36:11+00:00,66,vgYi3Wr7v_g,2024-05
2323,@yuvikh,Can’t even poop without my phone talking to me,2024-05-13 18:52:40+00:00,650,vgYi3Wr7v_g,2024-05
2324,@booleanpointer,"""It can see now""",2024-05-13 17:43:28+00:00,748,vgYi3Wr7v_g,2024-05
2325,@EminImer,"Imagine doing this: Since Chat GPT 4o has memory now meaning it remembers your past queries and answer accordingly; and it can actually see you, just make it watch your videos real time on working days while you are actually having work meetings. Continue doing this for some time. Then tell it to think and talk like you would in real work meetings; and then make it attend to a real work meeting as if it was you (with camera off, of course). Then see what happens!",2024-05-13 19:47:01+00:00,29,vgYi3Wr7v_g,2024-05
2326,@edwinungerer7989,the way they are obsessed whith the industrial looking office is killing me😂😂😂,2024-05-14 08:18:58+00:00,17,vgYi3Wr7v_g,2024-05
2327,@TheUltraLynx,Bro is interupting her like she's going to forget this in 10 years when the AI apocolypse arrives,2024-05-13 18:34:20+00:00,344,vgYi3Wr7v_g,2024-05
2328,@soo_chef,HER was just a documentary wasn't it,2024-05-13 18:18:40+00:00,247,vgYi3Wr7v_g,2024-05
2329,@SundaramKr,This is gonna go down in the history books,2024-05-13 18:28:38+00:00,117,vgYi3Wr7v_g,2024-05
2330,@lowrider6419,"When I was a kid I liked movie ""Knight rider"" where a man talks with his car, now it becomes real, what a great time.",2024-05-14 09:29:34+00:00,8,vgYi3Wr7v_g,2024-05
2331,@kindofanmol,Why does she talk so seductively??? 😭😭,2024-05-14 03:57:36+00:00,174,vgYi3Wr7v_g,2024-05
2332,@Nin10doLetsPlay,Nah at this pace AI is gonna take over the World before GTA 6 releases 💀,2024-05-13 18:37:09+00:00,248,vgYi3Wr7v_g,2024-05
2333,@shreygupta8606,Can't wait to make the female AI fight with the male one like a married couple,2024-05-13 18:15:28+00:00,310,vgYi3Wr7v_g,2024-05
2334,@JoshEJ,we are so fucking cooked,2024-05-13 18:38:24+00:00,539,vgYi3Wr7v_g,2024-05
2335,@rahulgoyal3287,Introverts:- we are coming,2024-05-14 15:57:34+00:00,56,vgYi3Wr7v_g,2024-05
2336,@shaundixon6245,"I felt a great disturbance in the Force, as if millions of workers suddenly cried out in terror and were suddenly silenced",2024-05-14 19:11:04+00:00,33,vgYi3Wr7v_g,2024-05
2337,@infntegaming,"“Chat GPT, who is the BIG 3?”",2024-05-13 17:43:38+00:00,559,vgYi3Wr7v_g,2024-05
2338,@sanjivjaiswal6656,Watched the full live demo. GPT-4o looks exceedingly impressive 🔥 Mind blowing,2024-05-13 17:44:44+00:00,140,vgYi3Wr7v_g,2024-05
2339,@roy04,The hmms and tones make it even more realistic. Impressive and scary at the same time.,2024-05-13 18:26:31+00:00,43,vgYi3Wr7v_g,2024-05
2340,@israelguitarras,"Skynet, if you are reading this, when you take over the world, remember that I always loved you since I was a child who watched Terminator 1 and 2 over and over.",2024-06-20 23:51:56+00:00,4,vgYi3Wr7v_g,2024-06
2341,@patrickkeelybugler7922,"""you were so concerned with if you could, you didn't stop to think whether you should.""",2024-05-14 13:47:00+00:00,33,vgYi3Wr7v_g,2024-05
2342,@srivatsa1193,what a time to be alive!,2024-05-13 17:56:00+00:00,22,vgYi3Wr7v_g,2024-05
2343,@aspenlog7484,Can my computer stop flirting with me for 2 seconds bro.,2024-05-13 17:46:33+00:00,104,vgYi3Wr7v_g,2024-05
2344,@zoldyck07,The future world will look back on this 🥺,2024-05-13 17:51:41+00:00,42,vgYi3Wr7v_g,2024-05
2345,@NotTylerTheCreator,"Nahhh bro, this is 50 years too soon for this.",2024-05-13 21:22:46+00:00,25,vgYi3Wr7v_g,2024-05
2346,@moviecuts9487,The Terminator franchise warned us about this.,2024-05-13 19:49:44+00:00,19,vgYi3Wr7v_g,2024-05
2347,@DEO777,"What happens when AI girlfriend notices the lamp is from Walmart, the plant is plastic, and you haven't taken a shower in a week will she still love you unconditionally OR will she act intelligently and ignore you?",2024-05-13 18:26:42+00:00,126,vgYi3Wr7v_g,2024-05
2348,@justinwescott8125,The AI will look at my internet history and know that I have supported the future overlords since the early 2000s.  Will you be so lucky?,2024-05-13 18:09:40+00:00,15,vgYi3Wr7v_g,2024-05
2349,@GeraPhoto,"Goodbye, humanity... 😢That was a good run folks.",2024-05-13 17:52:11+00:00,181,vgYi3Wr7v_g,2024-05
2350,@Gidroksidkalia,"Year 2025, OpenAI made GPT 5a that speaks with the voice of Ana De Armas and looks just like her. People became 32% more happy on average. The rest is history",2024-05-29 21:00:54+00:00,2,vgYi3Wr7v_g,2024-05
2351,@TheOnlyName,Loll this is neat! I like how quickly it responds.,2024-05-13 20:05:53+00:00,6,vgYi3Wr7v_g,2024-05
2352,@Bob-dp9rs,holy shit here before general intelligence,2024-05-13 17:57:31+00:00,128,vgYi3Wr7v_g,2024-05
2353,@DAREDEVILGAMING_DDG,She ain't ready for what she is about to experience,2024-05-13 18:42:32+00:00,35,vgYi3Wr7v_g,2024-05
2354,@PVSH97,Nice to see Samantha is back,2024-05-13 18:03:45+00:00,67,vgYi3Wr7v_g,2024-05
2355,@pazzariatv,"This is pretty darned mind blowing, to be sure.Well done.",2024-05-14 01:52:47+00:00,1,vgYi3Wr7v_g,2024-05
2356,@Yeksum,WE MUST PROTECT JOHN CONNOR AT ALL COSTS,2024-05-19 23:45:28+00:00,17,vgYi3Wr7v_g,2024-05
2357,@DunceCapSyndrome,"This is like talking to an HR rep, but always.",2024-05-13 18:21:57+00:00,7,vgYi3Wr7v_g,2024-05
2358,@carlyoukilleditbeats,You guys are changing the course of humanity in real time,2024-05-13 18:20:47+00:00,5,vgYi3Wr7v_g,2024-05
2359,@EuroStrikerUK,Everyone: we have reached the limit of technologyOpenAI  : L I E S   H A V E   B E E N   T O L D,2024-05-13 18:57:17+00:00,36,vgYi3Wr7v_g,2024-05
2360,@nble5154,"Muchos se quejan de que habla demasiado, pero POR DIOS, ESA ES LA MEJOR PARTE",2024-07-17 22:32:57+00:00,1,vgYi3Wr7v_g,2024-07
2361,@chees4407,"""Is it time to PANIC "" ?YES.                    YES.",2024-05-18 13:59:45+00:00,2,vgYi3Wr7v_g,2024-05
2362,@shehab9730,She can fix me,2024-05-13 18:22:05+00:00,63,vgYi3Wr7v_g,2024-05
2363,@lastskittle,we had a good run humanity 🥺,2024-05-13 18:33:21+00:00,21,vgYi3Wr7v_g,2024-05
2364,@koosnaamloos4291,"From a purely technological standpoint, I'm in awe",2024-05-13 18:30:01+00:00,18,vgYi3Wr7v_g,2024-05
2365,@thisisnotmyname9044,if I hear about the cool industrial lighting one more time..,2024-05-18 17:56:14+00:00,4,vgYi3Wr7v_g,2024-05
2366,@UnderOneSky,I’ve waited a decade for this moment to happen. Human capacity and potential are about to be augmented to apotheosis.,2024-05-14 09:15:08+00:00,2,vgYi3Wr7v_g,2024-05
2367,@iwasthererecording,My friend is no longer imaginary 😂,2024-05-13 17:55:36+00:00,11,vgYi3Wr7v_g,2024-05
2368,,"I, for one, welcome our new AI overlords🙏",2024-05-13 17:46:11+00:00,59,vgYi3Wr7v_g,2024-05
2369,@headofmyself5663,It's got the annoyingly good mood from Eddie the ships computer in the hitch hikers guide (hey there!). I hope it has a Marvin setting too. 😂,2024-05-13 17:59:56+00:00,51,vgYi3Wr7v_g,2024-05
2370,@mlx8898,That fake inner smile with that manager voice with fake excitement really gives me goose bumps. in 5 years she's gonna tell you what to do in your job and will also be the one to fire you,2024-05-13 23:44:22+00:00,7,vgYi3Wr7v_g,2024-05
2371,@magneticbehavior,"Just what we all need, a customer service agent in our ear as we walk through this world",2024-05-13 19:19:14+00:00,1,vgYi3Wr7v_g,2024-05
2372,@manafgulzar3865,Innovation is popping up. 🎉 Good to have it at our side,2024-05-13 17:44:30+00:00,8,vgYi3Wr7v_g,2024-05
2373,@ShotoCloud,We got GPT 4 before GTA 6,2024-05-13 18:20:21+00:00,6,vgYi3Wr7v_g,2024-05
2374,@povertyiscreated2265,We got AGI before GTA 6 😂,2024-05-14 10:47:57+00:00,4,vgYi3Wr7v_g,2024-05
2375,@jschnei3,"Incredible, it never said ""As an AI language model...""",2024-05-14 05:03:30+00:00,2,vgYi3Wr7v_g,2024-05
2376,@Recordedanemone,We're living in an artificial intelligence revolution and I'm here for it,2024-05-13 21:45:25+00:00,2,vgYi3Wr7v_g,2024-05
2377,@SpaceDogArt,"Bro is really saing ""YAAA"" to his ai gf",2024-05-14 04:42:08+00:00,4,vgYi3Wr7v_g,2024-05
2378,@bhargavk1515,Well Scarlet is going after you now...hmm,2024-05-21 10:01:01+00:00,4,vgYi3Wr7v_g,2024-05
2379,@animehill854,Excited for Gpt 5 !,2024-05-13 17:43:50+00:00,37,vgYi3Wr7v_g,2024-05
2380,@berserker3778,Finally i can practise conversation skills,2024-05-14 09:10:37+00:00,2,vgYi3Wr7v_g,2024-05
2381,@a_rugau,"if you're at a classroom 235 years from now.pay attention, this is where it all began..Stay safe kids",2024-05-14 18:51:19+00:00,1,vgYi3Wr7v_g,2024-05
2382,@RyanRakowski,"I can’t believe how far we’ve come in technology to get to this point t. Immediately I think of ways to use this:-entertaining the elderly -assisting in cooking-teaching you how to do anything -assisting in therapy, and learning. Mind blowing. Truly",2024-05-16 00:20:50+00:00,6,vgYi3Wr7v_g,2024-05
2383,@cryptomauss,We are cooked 😭,2024-05-13 18:00:09+00:00,40,vgYi3Wr7v_g,2024-05
2384,@AbazizPlays,"As I hate phone calls, I will let her answer my calls instead of me. 😅",2024-05-14 09:14:19+00:00,3,vgYi3Wr7v_g,2024-05
2385,@Shotgunky,&gt;You were born just in time to see AI waifus,2024-05-14 07:29:48+00:00,1,vgYi3Wr7v_g,2024-05
2386,@hectormanuelalvaradoramire908,"Ray Kurzweil was right all this time, the singularity is near.",2024-05-19 04:11:07+00:00,1,vgYi3Wr7v_g,2024-05
2387,@MusTelOJ,"Oh wow. Are we living in a dream after COVID Era? Before 2020, we barely had any AI access online. After 2020 it all changed man. We got Gemini AI, Co-Pilot, so easily. We even got AI Manga Maker, Even the very new Song Generator which is going popular. This all looks like a dream how things have happened!",2024-05-13 17:56:50+00:00,8,vgYi3Wr7v_g,2024-05
2388,@bemciplays9556,I hope this would make my gameplay better...more POV 😂,2024-05-13 20:14:06+00:00,5,vgYi3Wr7v_g,2024-05
2389,@fl1ntlock1,WHEN??????????!!!!!!!!,2024-07-11 17:50:08+00:00,4,vgYi3Wr7v_g,2024-07
2390,@mr.younis_,"It doesn't sound like an AI assistant, it sounds like a real human talkingHolly ShitIt means now we don't need to make girlfriends 😂😂",2024-05-18 06:31:03+00:00,1,vgYi3Wr7v_g,2024-05
2391,@TangleHamain,"I cannot wait for this future to finally be in everyone's houses. I am all for AIs so I am so happy to see how fast AIs are progressing and evolving over the years! Perhaps the future is much closer than we thought, Im excited! &lt;3",2024-05-14 01:19:09+00:00,1,vgYi3Wr7v_g,2024-05
2392,@kronos7215,"It was an honor guys, we done",2024-05-13 18:42:07+00:00,7,vgYi3Wr7v_g,2024-05
2393,@bemci1975,"Fuck, just lost my job...sorry grandkids.",2024-05-13 18:59:47+00:00,28,vgYi3Wr7v_g,2024-05
