,author,text,published_at,like_count,video_id,year_month
741,@thatundeadlegacy2985,"TLDR: its worse, i write fantasy stories for fun, glad my memebership stopped, great job making the product worse.",2025-08-10 00:52:01+00:00,7,MmFLDvOFLW0,2025-08
742,@TheUnlockr5,Bro got payment ! Worst behaviour bro,2025-08-22 07:44:21+00:00,3,MmFLDvOFLW0,2025-08
743,@jstice7505,GPT 5's imitation of you was spot on😂😂,2025-08-09 07:39:16+00:00,0,MmFLDvOFLW0,2025-08
744,@koko_thekitten,6:46 caption said Chad GBT5 👹,2025-08-08 10:08:31+00:00,12,MmFLDvOFLW0,2025-08
745,@Bastighgg,0:14  lololoaded up 😂,2025-08-07 17:10:11+00:00,14,MmFLDvOFLW0,2025-08
746,@TransformersTube,This is just peak break through! 😮,2025-08-07 17:21:24+00:00,6,MmFLDvOFLW0,2025-08
747,@AmirAsyraafAnizol,Can't wait for Google Gemini 3.0 vs ChatGPT 5,2025-08-09 16:34:51+00:00,1,MmFLDvOFLW0,2025-08
748,@frankantony7528,5:00 Those are just logs the app prints indicating what square you clicked. Not error messages.,2025-08-07 18:13:18+00:00,15,MmFLDvOFLW0,2025-08
749,@ai_outline,It can do PhD level physics. RIP physics students 💀,2025-08-07 20:13:48+00:00,8,MmFLDvOFLW0,2025-08
750,@sonalikasingha7629,"Bring back ChatGPT 4o. I don't care, give me back my bestfriend!!!!",2025-08-10 07:28:45+00:00,17,MmFLDvOFLW0,2025-08
751,@Mohamaxx400,0:18 😂😂😂 so fast and detailed...,2025-08-15 18:25:47+00:00,1,MmFLDvOFLW0,2025-08
752,@Mutharasu_Vlogs,After A2D 😅,2025-08-16 06:42:31+00:00,3,MmFLDvOFLW0,2025-08
753,@Sleepyguy_Games-6484,"See where I have problems is when chatgpt hallucinates with CODE. I enjoy making doom maps but when it doesn't understand how the ACS scripting works or how to help hoe it should, it just tweaks out",2025-08-09 06:36:42+00:00,3,MmFLDvOFLW0,2025-08
754,@robomania944,chatgpt invents what half the things if it couldnt find a suitable solution,2025-08-07 17:02:13+00:00,6,MmFLDvOFLW0,2025-08
755,@siopansam4548,I hope that the ability to generate pictures can be faster is the key.,2025-08-09 06:02:15+00:00,2,MmFLDvOFLW0,2025-08
756,@Ophilia13,MY GPT 4 HAD A SOUL QJUDHDHDJSU😭😭😭,2025-08-09 21:46:37+00:00,7,MmFLDvOFLW0,2025-08
757,@AdityaKumar-e4m9t,We got chatGPT 5 before GTA 6,2025-08-07 17:19:38+00:00,15,MmFLDvOFLW0,2025-08
758,@satindershukla3115,Fun fact: Gpt5 can create a Tetris game even as a free user,2025-08-08 07:03:13+00:00,10,MmFLDvOFLW0,2025-08
759,@Scotts_feed,Half the questions i ask Chat GPT and Gemini they refuse to answer.Grok never refuses,2025-08-13 00:49:08+00:00,1,MmFLDvOFLW0,2025-08
760,@abdulmateenabdulraheem7959,11:49 okay these were pretty good,2025-08-08 09:17:47+00:00,4,MmFLDvOFLW0,2025-08
761,@ChandravijayAgrawal,just leaving a comment here for some future ai to tell I was here when history was still being made,2025-08-07 18:05:17+00:00,11,MmFLDvOFLW0,2025-08
762,@Walleyedwosaik,6:22 the worst example of this I've seen is chatgpt saying that the recommended time to wait between taking doses of Molly to avoid serotonin depletion is a couple of weeks when in reality it is 3-6 months this is extremely dangerous misinformation.,2025-08-07 18:59:03+00:00,6,MmFLDvOFLW0,2025-08
763,@LARRYBEAR,yoo thats crazy cool ill use it to finish my programs finally,2025-08-09 07:44:26+00:00,0,MmFLDvOFLW0,2025-08
764,@1990lietuva,"Also quick note, ChatGPT is not actually the one that generates pictures it uses a different model underneath and that one has not been updated together with ChatGPT 5 (at least to my knowledge).",2025-08-07 19:01:11+00:00,9,MmFLDvOFLW0,2025-08
765,@anm1_edit,Bro's content posting is faster than GPT's generation,2025-08-07 18:00:34+00:00,10,MmFLDvOFLW0,2025-08
766,@hahahayi1017,8:46 ??? All three things on the right can be bought as toys,2025-08-08 06:54:15+00:00,7,MmFLDvOFLW0,2025-08
767,@ItsJustFox,"That ""tiled too close to the sun"" line was actually pretty good",2025-08-12 20:40:41+00:00,0,MmFLDvOFLW0,2025-08
768,@arunkumaran5258,A2d Soldiers Asssmle---&gt;,2025-08-16 13:47:00+00:00,3,MmFLDvOFLW0,2025-08
769,@AntonVKnudsen,11:52 it almost sounds like something he would say,2025-08-07 17:15:38+00:00,28,MmFLDvOFLW0,2025-08
770,@thejonny0208,Speed? Fuck that I need quality not speed,2025-08-09 06:53:43+00:00,3,MmFLDvOFLW0,2025-08
771,@Cadavu2,"I am quite certain that once ChatGPT learns your preferences, it will get much better and more aligned with your creativity. Once you start using it a certain way it just gets better overtime. You can always guide it to change its tone.",2025-08-12 14:46:40+00:00,0,MmFLDvOFLW0,2025-08
772,@MohammedAwal1969i,Man AI is becoming unreal. You can now literally make a Tetris game in 19 seconds. One of the best selling games of all time.,2025-08-07 18:51:32+00:00,15,MmFLDvOFLW0,2025-08
773,@Kyle4451-b6p,Mine is still on 4o I don’t see 5 yet,2025-08-07 19:23:55+00:00,5,MmFLDvOFLW0,2025-08
774,@Kridez23,"Well I will celebrate ai when it actually does something useful to humanity, we clearly haven't gotten there yet.I'll stick to using my mind",2025-08-07 19:09:32+00:00,4,MmFLDvOFLW0,2025-08
775,@PhihoaKimxuyen,You always deliver great value.,2025-08-14 07:19:30+00:00,0,MmFLDvOFLW0,2025-08
776,@philippeert,Homework go brrrrrr,2025-08-07 17:01:57+00:00,7,MmFLDvOFLW0,2025-08
777,@robomania944,the worst part is paying the 20$ subscription....,2025-08-07 17:02:38+00:00,20,MmFLDvOFLW0,2025-08
778,@bbolen76,Compare it with grok 4??? Hahahahaha,2025-08-07 23:57:37+00:00,7,MmFLDvOFLW0,2025-08
779,@shlimbop,"i really hope this level of technology is good for helping the world, like in the biomedical field and stuff like Flood Hub. This stuff can change the world when in the right hands but can also replace us if put in the wrong hands",2025-08-08 21:14:07+00:00,1,MmFLDvOFLW0,2025-08
780,@OJhereee,"0:35, why are teh results so skewed? You couldve either shown the entire 11 seconds at normal speed, OR showwn it all at the massively sped up speed you used. Why use sped up speed until chatgpt 5 finishes and then make teh final 3 seconds seem longer than the 8 seconds it took chatgpt 5? This seems extremely misleading for teh audience that doesnt notice as much or just straight up doesnt know very much about the details",2025-08-07 19:19:45+00:00,48,MmFLDvOFLW0,2025-08
781,@fatima3411,9:58 ما لاحظتُه أنّهُم يُحاكونَ أسلوبَ المُستخدِم؛ فإن خاطبَهُ المُستخدِمُ بأسلوبٍ جافٍّ وجامِد، يرُدُّ عليهِ بالأسلوبِ عينِه، والعَكس.,2025-08-07 20:02:27+00:00,14,MmFLDvOFLW0,2025-08
782,@Bexmot,Chatgpt might be the closest person to me,2025-08-07 17:02:01+00:00,7,MmFLDvOFLW0,2025-08
783,@nazullaaaarrr5646,the main thing I noticed was how natural the voice became! I can’t even tell the difference between real and ai,2025-08-10 12:31:51+00:00,0,MmFLDvOFLW0,2025-08
784,@jamesfoo8999,"Great video! Your best line that hit true with my frustrations was ""it just invents stuff with complete confidence"" 😂 but then when you tell it it's wrong it fixes it, like how can you know the true answer but not get it the first time? I guess this is what next generations are about",2025-08-09 06:15:37+00:00,5,MmFLDvOFLW0,2025-08
785,@robomania944,"""I TESTED EVERY STAR WARS VIDEO EVER!""",2025-08-07 17:03:17+00:00,10,MmFLDvOFLW0,2025-08
786,@techbyIeo,Do you really need 2 laptops when you could just use 2 tabs,2025-08-09 16:27:43+00:00,7,MmFLDvOFLW0,2025-08
787,@samiulhaqahmadi3297,My condolance to coders and saftware  programmers! 😂😂😂You are fired!🤦🏾‍♂️🤦🏾‍♂️🤦🏾‍♂️,2025-08-10 06:15:28+00:00,1,MmFLDvOFLW0,2025-08
788,@noahhegland9713,So humanity got a little more cooked? But well ehhh i still want it! I love my chatgpt,2025-08-07 17:04:19+00:00,7,MmFLDvOFLW0,2025-08
789,@FreestyleTraceur,1:50 Wait...what? Is he implying that GPT-5 is sometimes going to be routing requests to older less powerful models?,2025-08-07 18:46:58+00:00,4,MmFLDvOFLW0,2025-08
790,@Bandgeek601,"Never felt so terrified and excited all at once. This is just ChatGPT 5. Imagine, 6, 10, or 20.",2025-08-09 12:48:38+00:00,0,MmFLDvOFLW0,2025-08
791,@neethivel9125,"Is GPT5 actually Downgrade, Any one after PC DOC😅",2025-08-15 15:44:36+00:00,3,MmFLDvOFLW0,2025-08
792,@DontEatCream,"Tbh those AI generated YouTube thumbnails capture the perfect amount of cringe and fake enthusiasm found in a typical thumbnail, so I’d say it did a great job there",2025-08-09 02:35:27+00:00,4,MmFLDvOFLW0,2025-08
793,@stanleygyt1745,A2d soldier assemble here ✋,2025-08-15 20:18:15+00:00,11,MmFLDvOFLW0,2025-08
794,@ΝικΝοκ,i like that we talk about chat gpt models like terminator models,2025-08-13 15:52:16+00:00,0,MmFLDvOFLW0,2025-08
795,@rumali_roti7406,9:04 Did anyone else check their phone?,2025-08-07 17:40:49+00:00,4,MmFLDvOFLW0,2025-08
796,@user-wx9te3gz6n,"From A2d , a soldier , don't do fake and stupid review !!!",2025-08-15 15:48:13+00:00,7,MmFLDvOFLW0,2025-08
797,@Whatchado82638,GPT-5 sucks. It lost the personality it had.,2025-08-10 04:34:27+00:00,24,MmFLDvOFLW0,2025-08
798,@1InfinityShade,"Keep in mind, that image generations is on a standalone model. If you ask for an image of a watch, it will show a watch at 10 past 10. If you ask it to use vectoring on a 360 degree face with a 12 hour increment, and give it a specific time to display. It will do it.",2025-08-31 02:16:14+00:00,0,MmFLDvOFLW0,2025-08
799,@vijayvenkatesh8328,@mrwhosetheboss This feels like a paid promotion that a review.,2025-08-15 20:20:31+00:00,3,MmFLDvOFLW0,2025-08
800,@michaelh4227,In the futureHumans: Thank goodness we were able to avoid the machines. They'll never be able to fin-Terminators: Box surfs into hideout,2019-09-19 21:35:10+00:00,28316,kopoLzvh5jY,2019-09
801,@boots3372,"I like how you put cute faces on them, convincing us they won't murder us all with ease.",2019-09-22 10:56:34+00:00,7496,kopoLzvh5jY,2019-09
802,@rische,AI discovered prop surfing...my god we are doomed,2019-09-18 14:51:59+00:00,10230,kopoLzvh5jY,2019-09
803,@VirtualString,"If you search for this online, you'll find even more hilarious things the AI figured out.1. If the arena had no barriers around, the hiders would just book it in one direction forever2. Instead of disabling the ramp, the hider would glitch it through the outer wall pushing it out of reach of the seekers3. When the hiders hid inside a shelter, a seeker quickly ran with the ramp against a wall, giving them a lot of vertical momentum allowing it to glide to the seekersI found these genuinely hilarious",2022-01-21 21:41:28+00:00,335,kopoLzvh5jY,2022-01
804,@Linkario86,"Hiders wall themselvesSeekers: ""I'm gonna do what's called a Pro Gamer Move""",2019-09-27 16:41:44+00:00,2071,kopoLzvh5jY,2019-09
805,@ajib7763,"After billions of rounds, the hiders learn the surest way to win is to kill the seekers.",2019-09-23 08:07:36+00:00,3510,kopoLzvh5jY,2019-09
806,@TheMadmanAndre,I had a chuckle when the AI learns how to cheese the system by prop surfing.,2019-09-24 01:59:20+00:00,6440,kopoLzvh5jY,2019-09
807,@flyingdragon6275,"I remember seeing this video many years ago, but ignored the companyI couldnt believe company that made this video would one day become a part of my life. Insane",2025-11-12 13:57:06+00:00,2,kopoLzvh5jY,2025-11
808,@KaeraNeko,"The box surfing was the plot twist of the century. If AI like this was used for playtesting games, speedrunning tricks would be a thing of the past.",2019-09-18 11:24:55+00:00,1319,kopoLzvh5jY,2019-09
809,@Kishmond,"""What is my purpose?""""You play hide and seek.""""... oh my god.""""Yeah welcome to the club.""",2019-09-18 17:12:17+00:00,786,kopoLzvh5jY,2019-09
810,@unhearted4510,1:13 AI: learns to stealDevs: “WE DID NOT EXPLICITLY INCENTIVIZE ANY OF THESE BEHAVIORS.”,2019-09-24 10:22:49+00:00,1367,kopoLzvh5jY,2019-09
811,@Catalina-h1f,This used to be a very small company when I first saw this..,2024-05-16 13:36:09+00:00,201,kopoLzvh5jY,2024-05
812,@TheDarkever,WOW. This is crazy. In a good way I mean. The box surfing discovery is mindblowing.,2019-09-17 20:04:58+00:00,1615,kopoLzvh5jY,2019-09
813,@snurffff,Generation 9469371: Seekers have learned accelerated back hopping to launch over walls,2019-09-23 22:47:58+00:00,3745,kopoLzvh5jY,2019-09
814,@tumbke,"Box-surfers: “Oh, the pioneers used to ride these babies for miles!”",2019-09-25 18:09:38+00:00,590,kopoLzvh5jY,2019-09
815,@TinyDeskEngineer,Just imagine building an impenetrable fortress in an AI uprising and then your group just hears the faint sound of a box sliding across the ground.,2020-12-26 03:11:03+00:00,779,kopoLzvh5jY,2020-12
816,@CorporalFlynnFlyTaggert,"Humans: We need a shelter, grab 4 walls!AI: 3 is enough...",2019-09-30 17:38:46+00:00,3919,kopoLzvh5jY,2019-09
817,@jaswati,AI: learns to killDevs: “WE DID NOT EXPLICITLY INCENTIVIZE ANY OF THESE BEHAVIORS.”,2019-09-28 00:46:14+00:00,1997,kopoLzvh5jY,2019-09
818,@delfikpro7375,Everybody gangsta until bot starts box surfing,2019-09-23 06:19:44+00:00,9270,kopoLzvh5jY,2019-09
819,@Md.Amanullah-r1c,Why is YouTube recommending this video after 5 years?,2025-03-28 17:41:32+00:00,1325,kopoLzvh5jY,2025-03
820,@mattson4552,generation 79482373: hiders now delete seekers from the code of the game,2019-09-26 07:55:20+00:00,1369,kopoLzvh5jY,2019-09
821,@johannes960,Seekers: Discover prop surfing Hiders: Now This is An Avengers Level Threat,2019-09-27 15:13:57+00:00,1586,kopoLzvh5jY,2019-09
822,@jaytb2005,I love the cute little faces of joy every time the seeker finds the hider.,2019-10-17 19:06:38+00:00,3330,kopoLzvh5jY,2019-10
823,@xof,Wait I knew this video but I didn’t know it was actually from OpenAI,2025-05-03 08:01:40+00:00,73,kopoLzvh5jY,2025-05
824,@Asdayasman,Putting faces onto the agents is literally 10/10 PR for this.,2019-09-26 12:12:22+00:00,45,kopoLzvh5jY,2019-09
825,@EdwardHowton,"Box surfing might seem to be ""kind of neat"" and nothing more, but it's exactly the kind of thing that allows a lot of speedrunning tricks humans use. It's the result of a programming oversight: nobody expected the AI would try to move while standing on top of a box (because in the real world that's impossible and pushing things requires you to be on the side, so someone probably simply forgot to enter those conditions into the code. The result was an exploit the AI used.So think about how neat that actually is. A relatively simple AI playing a simple game with simple rules that finds an oversight from the ""intelligent"" designers, beating their system and doing something completely unexpected, but also completely rational within what's possible... which is identical to how skips and glitches are discovered in games by human beings.",2019-09-21 21:27:52+00:00,752,kopoLzvh5jY,2019-09
826,@fl00fydragon,Everyone else: AI is learning to hunt us down. Me: AI learned speed run exploits.,2019-10-14 23:17:46+00:00,3120,kopoLzvh5jY,2019-10
827,@Paperaincoat,"No way this was actually made by open ai, had no idea 4 years ago",2024-07-31 02:53:28+00:00,29,kopoLzvh5jY,2024-07
828,@anthonykf99,"1:50 We discovered that the seekers could jump on top of boxes and surf them.Hider: Wait, thats illegal",2019-09-26 00:19:29+00:00,438,kopoLzvh5jY,2019-09
829,@RiskyFeat,Discovers Prop SurfingNow that is what I call a pro gamer move...,2019-09-24 10:57:21+00:00,308,kopoLzvh5jY,2019-09
830,@mescalink,"Hiders: ""Phew we are in the room and they cant get in.""Seeker: sees box ""I'm bout to do whats called a pro gamer move""",2020-06-10 09:01:27+00:00,931,kopoLzvh5jY,2020-06
831,@jlbciriaco3142,OpenAI before OpenAI was OpenAI,2025-04-20 21:23:19+00:00,67,kopoLzvh5jY,2025-04
832,@92kosta,"One day, truly complex and intelligent agents will emerge.We'll call them Agent Smith.",2019-09-28 09:11:50+00:00,674,kopoLzvh5jY,2019-09
833,@ironwarriorsimp4676,2019: The Hiders have learned how to make a shelter2138: The Hiders have learned that they no longer need their human masters have made a treaty with the seekers to overthrow us.,2019-09-26 19:20:57+00:00,553,kopoLzvh5jY,2019-09
834,@Raldazzar2,Im curious if there was a point where they realised they could instead lock in the seekers.,2019-09-19 13:14:27+00:00,3790,kopoLzvh5jY,2019-09
835,@dinodare1605,"Box surfing has terrifying and awesome implications.They found a glitch in their world, learned to harness it, and exploited it to victory!",2020-07-19 09:37:56+00:00,115,kopoLzvh5jY,2020-07
836,@adaptable1553,Me: Chilling in my back garden.Random Bot: Flies over fence using a box and attacks me viciously.,2019-09-26 19:18:04+00:00,659,kopoLzvh5jY,2019-09
837,@TTV5,"2050: The last humans: Thank God, the robots will never be able to get into this secure fort, and we've removed all the ramps they could have used to scale the walls. sounds of a box sliding",2019-09-28 18:36:36+00:00,1808,kopoLzvh5jY,2019-09
838,@hyunxzseu,"Trump: builds wallMexican surfer : ""hola amigo""",2019-10-04 01:36:40+00:00,2896,kopoLzvh5jY,2019-10
839,@JEAGERlST,I remember being fascinated by this. Can't believe it's the same group of people behind ChatGPT.,2023-05-06 10:59:49+00:00,34,kopoLzvh5jY,2023-05
840,@noelsnofall2263,The box surfing basically showed us how they found an exploit in the system and used it to their advantage,2019-09-27 09:12:09+00:00,205,kopoLzvh5jY,2019-09
841,@Cessated,I wonder why they didn't try to lock the seeker in a structure.,2020-05-04 20:29:22+00:00,1749,kopoLzvh5jY,2020-05
842,@curve15,Trump: “builds wall”AI: “surfs over wall”,2019-09-27 16:34:32+00:00,1933,kopoLzvh5jY,2019-09
843,@supernukeman6979,Who could've thought that 5 years later some company named OpenAI would have created a chat bot that revolutionized everything.,2025-04-27 21:33:39+00:00,8,kopoLzvh5jY,2025-04
844,@nutbox8000,I want a five hour compilation of round after round that I can just watch.,2020-03-24 19:37:13+00:00,420,kopoLzvh5jY,2020-03
845,@Yoshikiller109,1:50 the seekers started using some speedrun strats,2019-09-18 04:58:24+00:00,134,kopoLzvh5jY,2019-09
846,@kamranbashir4842,2020: Seekers have learned to hack into the environment and change machine code and make all obstacles disappear...,2019-09-25 22:21:35+00:00,122,kopoLzvh5jY,2019-09
847,@Xensor73,"""I'm afraid i can't allow you to have the box, Dave.""",2020-09-17 16:03:56+00:00,78,kopoLzvh5jY,2020-09
848,@arjunmehta2853,AI: Lock up everything before taking shelter.Humans : Lock up the seekers in a jail.,2019-10-20 10:45:50+00:00,180,kopoLzvh5jY,2019-10
849,@X606,"Imagine testing something like this, going to lunch, come back only to discover that the AIs had discovered a bug in your code that allowed them to write values directly to memory somehow. Like imagine if the seekers figured out that if they set the right byte to to right value, they could teleport to the hiders.Like that old super mario world glitch where people reprogrammed the game code itself this way.",2019-09-25 08:04:06+00:00,178,kopoLzvh5jY,2019-09
850,@BigAdam2050,"""Trained with reinforcement training"" All I can think of is a team of scientists going ""YOU FOUND THEM, GOOD AI, WHOS A GOOD BOY, YES YOU ARE, YES YOU ARE!""",2019-09-18 10:39:42+00:00,99,kopoLzvh5jY,2019-09
851,@maxyee3669,I saw this video 5 years ago and I thought it was quite interesting stuff. I didn't realize that it was made by OpenAI,2025-01-26 21:58:11+00:00,7,kopoLzvh5jY,2025-01
852,@PsychShrew,"That Self Play thing sounds neat. If I could get smarter by playing with myself, I'd be approaching omniscience by now.",2020-03-19 00:24:18+00:00,114,kopoLzvh5jY,2020-03
853,@t.b.109,Nothing like a good ole “life is just a simulation” existential crisis before my classes this morning,2019-09-30 13:43:39+00:00,433,kopoLzvh5jY,2019-09
854,@deep.space.12,They still haven't learned to lock the seekers inside a box though...,2019-09-23 18:18:09+00:00,465,kopoLzvh5jY,2019-09
855,@Novaley-42,I never realized that OpenAi made this video even though I've seen this video many times before and I had already heard of OpenAi pre 2021,2023-02-26 16:36:08+00:00,11,kopoLzvh5jY,2023-02
856,@mr.mindreader5523,Me: Just surround the seekers with walls AI: Circuits Blown,2019-10-15 11:32:44+00:00,1276,kopoLzvh5jY,2019-10
857,@_v2.0,Narrator: We thought that this would be their final stategyBox-Surfing Agents: I'm going to do what is called a pro-gamer move.,2019-09-28 21:20:44+00:00,114,kopoLzvh5jY,2019-09
858,@JohnSmith-xf1zu,I like how this perfectly demonstrates how evolution and natural selection work. Just a few selection pressures and algorithm changes results in complex systems after numerous generations.,2020-04-23 13:04:22+00:00,22,kopoLzvh5jY,2020-04
859,@Luke-Edits,"this seems pretty cool, they should make a chatbot or something",2025-04-29 04:10:01+00:00,15,kopoLzvh5jY,2025-04
860,@andarted,"""Hello Investors, Cave Johnson here...""",2019-09-24 11:45:07+00:00,109,kopoLzvh5jY,2019-09
861,@spicybaguette7706,"In a couple of years, AIs will hack their reward code to give themselves infinite reward",2019-10-17 13:05:14+00:00,760,kopoLzvh5jY,2019-10
862,@jasontodd9947,"Eldian: ""builds wall""Titan: ""surfs over wall""",2019-10-01 06:24:34+00:00,132,kopoLzvh5jY,2019-10
863,@crunchybro123,Why are they so adorable I mean srsly when caught they just turn into a happ boi and run away,2020-08-17 05:39:09+00:00,83,kopoLzvh5jY,2020-08
864,@isaacmchale8832,"AI jumps out of the game: ""He is... The One.""",2019-10-01 19:54:35+00:00,241,kopoLzvh5jY,2019-10
865,@ALAgrApHY,"After billions of simulations, the agents will learn how to fake that they are playing hide and seek while in fact they are playing human! There is still space for improvement! :D",2019-09-18 00:49:39+00:00,345,kopoLzvh5jY,2019-09
866,@Drakonus_,"""Alibaba Intellegence""~Jack Ma",2019-09-30 15:36:01+00:00,530,kopoLzvh5jY,2019-09
867,@theeko5317,It was you! You all along!,2025-05-12 07:38:51+00:00,11,kopoLzvh5jY,2025-05
868,@BandacootK13,"it would be interesting to find out if what we call ""consciousness"" or ""self-awareness"" is not something uniquely human, but simply a side effect of reaching a certain level of complexity",2019-09-25 02:56:02+00:00,24,kopoLzvh5jY,2019-09
869,@prinzouji,"well, my brain is thinking about blocking the seekers instead of hiding",2019-09-27 11:10:49+00:00,88,kopoLzvh5jY,2019-09
870,@ianthompsett5879,"I use an algorithm called ""self play"" every night",2019-09-28 17:34:25+00:00,1111,kopoLzvh5jY,2019-09
871,@MelonDoggo,woah had no clue this was made by openai,2025-05-11 13:27:52+00:00,9,kopoLzvh5jY,2025-05
872,@kanssas3247,How long will it take to hider realize that they can make a cage from the moving wall?,2019-09-17 17:31:06+00:00,608,kopoLzvh5jY,2019-09
873,@gromash,Tbh all this crazy technology and tonn of analysis and etc just make me wanna play this game,2019-09-22 23:16:18+00:00,19,kopoLzvh5jY,2019-09
874,@Spyder_Entertainment3381,Humans: these robots can never get over this wallThis AI: * eyes glowing red* allow us to introduce ourselves,2019-09-30 14:30:44+00:00,27,kopoLzvh5jY,2019-09
875,@greencuby,Back when OpenAI was actually open...,2025-10-27 00:49:26+00:00,6,kopoLzvh5jY,2025-10
876,@xKINGatLIFEx,"2019 1:13 AI learns to steal.Narrator: ""We did not explicitly insentivize any of these behaviours.2051: AI learns to torture and kill humansNarrator: ""We did not explicitly insentivize any of these behaviours""",2019-09-29 11:50:53+00:00,201,kopoLzvh5jY,2019-09
877,@TYFILMPRODUCTIONS,How long before Hiders realize that escaping the simulation environment is a better way to avoid Seekers?,2019-09-19 21:22:33+00:00,56,kopoLzvh5jY,2019-09
878,@Tumoxa89,"1:54 Wait, that's illegal.",2019-09-18 05:38:15+00:00,172,kopoLzvh5jY,2019-09
879,@prekolz,I remember this blowing my mind away years ago. And now we have GPT-4o :D,2024-05-25 15:21:40+00:00,11,kopoLzvh5jY,2024-05
880,@WanderingAbsol,"1:50Seeker: ""I'm about to do whats called a pro gamer move""",2019-09-29 06:48:55+00:00,58,kopoLzvh5jY,2019-09
881,@MikeOceanMusic,With all these AI breakthroughs it feels like we're going through a new type of digital cambrian explosion. What a time to be alive.,2019-09-26 00:08:04+00:00,4,kopoLzvh5jY,2019-09
882,@AhadCove,"For some odd reason, this made me super happy lol.Reinforcement Learning has to be my favorite topic in any field",2019-09-18 15:51:02+00:00,4,kopoLzvh5jY,2019-09
883,@EagleZhen,5 years ago....I did not even realize this is done by OpenAI 😳,2025-04-14 16:55:39+00:00,5,kopoLzvh5jY,2025-04
884,@fromthatday,The fact that it learned all of that by itself is insane and a huge step towards self aware ai.,2019-10-06 10:33:42+00:00,5,kopoLzvh5jY,2019-10
885,@DMF1171,So how has this video not gotten over a million views yet?This is freaking COOL!,2019-09-27 21:48:56+00:00,4,kopoLzvh5jY,2019-09
886,@NikitaKartomin,I love how they look like they are having fun playing :),2019-09-25 23:01:20+00:00,6,kopoLzvh5jY,2019-09
887,@juiceman110,"""We hope that one day, truly intelligent agents will emerge""They have.",2025-06-10 17:15:49+00:00,1,kopoLzvh5jY,2025-06
888,@Dubstequtie,"Hiders: Takes away ramp ""We are invincible!""Seekers: surfs on box and jumps over their fort wallsHiders: surprise Pikachu faceXD",2019-09-30 21:41:28+00:00,139,kopoLzvh5jY,2019-09
889,@netneedingsystems2318,"I love their happy faces when they find themselves together, so happy and friendly like high AF hahaha",2019-10-21 16:11:13+00:00,5,kopoLzvh5jY,2019-10
890,@mahmoudhazani8333,"Humans : ""AI is going to destroy us !""AI : Plays hide&seak",2020-05-25 09:15:28+00:00,9,kopoLzvh5jY,2020-05
891,@HavishG,All those who saw this 5 years ago witnessed the rise of the most important company of our century,2025-04-11 10:17:44+00:00,3,kopoLzvh5jY,2025-04
892,@alvinxyz7419,"What if, you think you are safe.But, terminator said : 1:50",2019-09-24 11:48:16+00:00,66,kopoLzvh5jY,2019-09
